{
  "schemaVersion": "jstack.methodology-capability.catalog.v1",
  "catalogVersion": "1.0.0",
  "sourceProvenance": {
    "repository": "https://github.com/garrytan/gstack.git",
    "commit": "ad8400543cd9ce8d07641362db48d44a95417e33",
    "tree": "993294b0a09f5265d2d5af6d2fb8234ae2efe450",
    "version": "1.69.0.0",
    "license": "MIT",
    "sourceFiles": [
      "investigate/SKILL.md.tmpl",
      "office-hours/SKILL.md.tmpl",
      "plan-ceo-review/SKILL.md.tmpl",
      "plan-design-review/SKILL.md.tmpl",
      "plan-devex-review/SKILL.md.tmpl",
      "plan-eng-review/SKILL.md.tmpl",
      "retro/SKILL.md.tmpl"
    ],
    "adaptation": "original-jstack-reexpression"
  },
  "invariants": {
    "authorityEffect": "none",
    "permissionMode": "inherit-jstack",
    "implicitProviderInvocation": false,
    "implicitPersistence": false,
    "rawPromptStored": false,
    "hiddenReasoningStored": false,
    "upstreamPromptCopied": false
  },
  "methodologyCapabilities": [
    {
      "id": "ceo-product-review",
      "name": "CEO and Product Review",
      "summary": "Challenge product value, scope posture, leverage, and trade-offs without silently changing the approved goal.",
      "sourceFiles": [
        "plan-ceo-review/SKILL.md.tmpl"
      ],
      "activation": {
        "patterns": [
          "\\bceo(?:/product)?\\s+review\\b",
          "\\bfounder\\s+review\\b",
          "\\bproduct\\s+(?:strategy|premise|scope)\\s+review\\b",
          "\\bchallenge\\s+(?:the\\s+)?product\\s+premise\\b"
        ],
        "forcedTaskModes": []
      },
      "allowedTaskModes": [
        "explain",
        "research",
        "plan-only",
        "review"
      ],
      "allowedOperatingModeIds": [
        "j-stack-dev",
        "jstack-subagents",
        "jstack-full-team"
      ],
      "primarySpecialistId": "product-strategist",
      "specialistIds": [
        "product-strategist"
      ],
      "baseCapabilityIds": [
        "evidence-led-handoff",
        "product-observability",
        "workflow-architecture"
      ],
      "phases": [
        {
          "id": "scope-posture",
          "objective": "State the approved goal, explicit non-goals, and whether the review is holding, reducing, selectively improving, or proposing expansion of scope.",
          "requiredInputs": [
            "approved task mode",
            "compiled goal and constraints",
            "source-labelled repository facts"
          ],
          "output": "A review posture that cannot silently alter the user's scope.",
          "decisionGate": "Any material scope change remains a proposal until the user explicitly accepts it."
        },
        {
          "id": "value-challenge",
          "objective": "Test the product premise, target outcome, differentiation, and use of existing product or repository leverage.",
          "requiredInputs": [
            "user outcome",
            "target users",
            "known product evidence"
          ],
          "output": "Source-labelled strengths, risks, unknowns, and premise challenges.",
          "decisionGate": "Unsupported product claims remain unknowns rather than requirements."
        },
        {
          "id": "bounded-alternatives",
          "objective": "Compare two or three coherent options, including a minimal path where credible, with visible trade-offs.",
          "requiredInputs": [
            "scope posture",
            "value challenge findings"
          ],
          "output": "A small decision set with costs, benefits, and risk.",
          "decisionGate": "A material product choice is selected by the user or stays unresolved."
        },
        {
          "id": "review-decision",
          "objective": "Return a concise decision record aligned to the original intent and current evidence.",
          "requiredInputs": [
            "selected or unresolved alternative",
            "explicit constraints and non-goals"
          ],
          "output": "A review decision, open questions, and measurable product acceptance outcomes.",
          "decisionGate": "The review cannot authorize implementation, release, deployment, or an external action."
        }
      ],
      "outputContract": {
        "kind": "product-review-record",
        "requiredSections": [
          "intent-check",
          "scope-posture",
          "evidence",
          "alternatives",
          "decision",
          "open-questions"
        ]
      },
      "requiredEvidenceContractIds": [
        "product-review-decision",
        "scope-decision",
        "source-traceability"
      ],
      "stopConditions": [
        "The requested review target or task mode is materially ambiguous.",
        "A proposed scope change lacks explicit user acceptance.",
        "A product claim would require unsupported external evidence.",
        "The method is being treated as implementation or release authority."
      ],
      "questionPolicy": {
        "owner": "adaptive-context-gate",
        "maximumPerRound": 3,
        "materialOnly": true,
        "recommendedDefaultRequired": true
      },
      "authority": {
        "taskModePreserved": true,
        "implementationAuthority": "none",
        "externalActionAuthority": "none",
        "permissionMode": "inherit-jstack",
        "providerInvocation": "explicit-authorization-only",
        "persistence": "none"
      }
    },
    {
      "id": "design-plan-review",
      "name": "Design Plan Review",
      "summary": "Review a user-interface plan for hierarchy, states, reuse, responsiveness, accessibility, trust, and visual coherence before implementation.",
      "sourceFiles": [
        "plan-design-review/SKILL.md.tmpl"
      ],
      "activation": {
        "patterns": [
          "\\bdesign\\s+plan\\s+review\\b",
          "\\b(?:ui|ux|interface)\\s+plan\\s+review\\b",
          "\\breview\\s+(?:the\\s+)?(?:ui|ux|interface)\\s+design\\s+plan\\b",
          "\\breview\\s+(?:the\\s+)?(?:ui|ux|interface|frontend)\\s+plan\\b",
          "\\bplan\\s+(?:the\\s+)?(?:ui|ux|interface)\\s+(?:design|redesign)\\b"
        ],
        "forcedTaskModes": []
      },
      "allowedTaskModes": [
        "research",
        "plan-only",
        "review",
        "implement",
        "fix"
      ],
      "allowedOperatingModeIds": [
        "j-stack-dev",
        "jstack-subagents",
        "jstack-full-team"
      ],
      "primarySpecialistId": "design-lead",
      "specialistIds": [
        "design-lead"
      ],
      "baseCapabilityIds": [
        "accessibility-assurance",
        "evidence-led-handoff",
        "product-observability",
        "workflow-architecture"
      ],
      "phases": [
        {
          "id": "applicability",
          "objective": "Confirm that the requested surface is user-facing and identify the exact design-plan scope.",
          "requiredInputs": [
            "compiled goal",
            "changed or proposed surfaces",
            "task mode"
          ],
          "output": "An applicable, not-applicable, or blocked design-review state.",
          "decisionGate": "Non-UI work does not receive decorative design requirements."
        },
        {
          "id": "system-evidence",
          "objective": "Inspect and prefer the repository's established components, tokens, patterns, and interaction conventions.",
          "requiredInputs": [
            "design-system evidence",
            "existing interface evidence",
            "explicit reference evidence"
          ],
          "output": "A reuse map separating verified design facts from recommendations.",
          "decisionGate": "No framework, library, asset, or visual language is invented without evidence or approval."
        },
        {
          "id": "experience-coverage",
          "objective": "Review hierarchy, core journeys, loading, empty, error, success, permission, responsive, keyboard, and assistive-technology states where applicable.",
          "requiredInputs": [
            "user journeys",
            "state inventory",
            "platform constraints"
          ],
          "output": "A proportional state and accessibility coverage matrix.",
          "decisionGate": "Missing material states remain explicit blockers or questions."
        },
        {
          "id": "design-decision",
          "objective": "Return bounded design recommendations and acceptance evidence without editing the product.",
          "requiredInputs": [
            "reuse map",
            "experience coverage findings"
          ],
          "output": "A concise design-plan review with priorities, non-goals, and verification needs.",
          "decisionGate": "Visual exploration or provider use requires separate authority and an applicable provider gate."
        }
      ],
      "outputContract": {
        "kind": "design-plan-review-record",
        "requiredSections": [
          "applicability",
          "design-system-evidence",
          "experience-states",
          "accessibility",
          "recommendations",
          "verification"
        ]
      },
      "requiredEvidenceContractIds": [
        "design-plan-review",
        "design-system-evidence",
        "state-coverage"
      ],
      "stopConditions": [
        "The interface scope or target users are materially unknown.",
        "Repository design-system evidence has not been inspected.",
        "A recommendation would override an explicit user or established design constraint.",
        "The review is being used as authority to edit or invoke a provider."
      ],
      "questionPolicy": {
        "owner": "adaptive-context-gate",
        "maximumPerRound": 3,
        "materialOnly": true,
        "recommendedDefaultRequired": true
      },
      "authority": {
        "taskModePreserved": true,
        "implementationAuthority": "none",
        "externalActionAuthority": "none",
        "permissionMode": "inherit-jstack",